{
  "lmp": "0.1",
  "id": "elaborative-interrogation",
  "name": "精细追问法",
  "name_en": "Elaborative Interrogation",
  "version": "0.1.0",
  "license": "CC0-1.0",
  "authors": ["OpenLMP 公共领域贡献"],
  "category": "理解构建",
  "evidence": "high",
  "evidence_refs": ["Pressley et al. 1987/1989, Journal of Educational Psychology"],
  "description": "对每个知识点连续追问「为什么」，把孤立事实挂到已有知识网络上。",
  "when_to_use": ["读教材读不懂", "知识点零散记不住", "考前快速串联知识"],
  "when_not_to_use": ["纯事实记忆（用 active-recall）"],
  "params": {
    "type": "object",
    "required": ["topic"],
    "properties": { "topic": { "type": "string" }, "depth": { "type": "integer", "default": 5, "description": "连续追问层数" } }
  },
  "requires": { "tools": [], "assets": [] },
  "steps": [
    {
      "id": "seed",
      "name": "定一个锚点命题",
      "instruction": "选定一个具体命题（不是主题），例如「细胞不能无限长大」。写成一句话。",
      "duration_min": 2,
      "checkpoint": "产出的是一句可判定真假的命题，不是「关于细胞分裂」这类名词短语",
      "output": "claim"
    },
    {
      "id": "chain-why",
      "name": "连续追问为什么",
      "instruction": "逐层追问「为什么」，每层追问都必须用上一层的答案作为下一层的问题。共问 depth 层。",
      "duration_min": 8,
      "checkpoint": "至少 4 层因果链；每层答案都不同质，不是同一句话换词",
      "output": "why chain"
    },
    {
      "id": "hole",
      "name": "标记断链处",
      "instruction": "找出因果链中断的地方——即「这一步其实我并不确定 / 只能靠背」的节点。这是本方法的核心产出。",
      "duration_min": 4,
      "checkpoint": "标出所有断链节点并写出「我到底不懂的是什么」",
      "output": "gap list"
    },
    {
      "id": "fill",
      "name": "只补最深的一处断链",
      "instruction": "选最深的一处断链，去查/去推，直到能用一句话接上因果链。只补这一处。",
      "duration_min": 8,
      "checkpoint": "该处断链被接上，且新答案引出至少一个新问题",
      "output": "patched chain",
      "fail_to": "chain-why"
    }
  ],
  "evaluate": {
    "self_check": [
      "追问过程中我是真的在推，还是在编一个听起来合理的故事？",
      "断链点是不是恰好是我考试会失分的地方？"
    ],
    "success_criteria": ["能不看资料复述完整因果链", "断链点数量逐次减少"]
  },
  "agent_contract": {
    "input": ["topic", "depth"],
    "output": ["claim", "why chain", "gap list"],
    "side_effects": ["仅写本地文件"],
    "degrade_to": "无法查证时：显式标注该层为「未验证假设」，禁止当作事实陈述"
  },
  "resources": [],
  "metadata": { "created_at": "2026-10-21", "updated_at": "2026-10-21", "contributors": [] }
}