{
  "lmp": "0.1",
  "id": "interleaving",
  "name": "交错练习",
  "name_en": "Interleaving",
  "version": "0.1.0",
  "license": "CC0-1.0",
  "authors": [
    "OpenLMP 公共领域贡献"
  ],
  "category": "记忆巩固",
  "evidence": "high",
  "evidence_refs": [
    "Taylor & Rohrer 2010, Journal of Educational Psychology, 102(3) 837-844",
    "Dunlosky et al. 2013, Psychological Science in the Public Interest, 14(1) 4-58"
  ],
  "description": "把同一科的多种题型混着练，逼大脑每次先判断「该用哪招」，而不是无脑套上一个刚练的模式。",
  "when_to_use": [
    "分章节练都挺顺、一综合就不会",
    "公式/方法长得像容易混",
    "数学或编程刷题"
  ],
  "when_not_to_use": [
    "完全零基础的新题型（先分块练熟再交错）"
  ],
  "params": {
    "type": "object",
    "required": [
      "topic"
    ],
    "properties": {
      "topic": {
        "type": "string",
        "description": "本次交错练习覆盖的范围，如「求极值」"
      },
      "rounds": {
        "type": "integer",
        "default": 12,
        "description": "题目总道数"
      }
    }
  },
  "requires": {
    "tools": [],
    "assets": []
  },
  "steps": [
    {
      "id": "inventory",
      "name": "列出待混题型",
      "duration_min": 4,
      "instruction": "把这个范围里会考的题型写成清单，每种一句话说明「看到什么特征就该用它」。至少 3 种。",
      "checkpoint": "题型清单 ≥ 3 种，且每种都附了一条可判别的识别特征",
      "output": "题型清单"
    },
    {
      "id": "shuffle",
      "name": "打乱出题",
      "instruction": "按清单混合出题，相邻两题不出现同一类型。让 Agent 一次只给一题，做完再给下一题。",
      "duration_min": 20,
      "checkpoint": "题序中不存在相邻同型；作答期间未展示答案",
      "output": "混合题组与作答记录"
    },
    {
      "id": "diagnose",
      "name": "归因错误类型",
      "instruction": "逐题标注错因：① 选错方法 ② 方法对但算错 ③ 概念不清。只标不改正。",
      "duration_min": 6,
      "checkpoint": "每道错题都归入①②③之一，且未混入评价性描述",
      "output": "错因标注表"
    },
    {
      "id": "repair",
      "name": "只补最集中的一类",
      "instruction": "统计三类各占多少，挑数量最多的那一类专项重练 5 题，其余两类先不动。",
      "duration_min": 10,
      "checkpoint": "专项重练题数 = 5，且全部属于被选中的那一类",
      "output": "专项重练结果",
      "fail_to": "shuffle"
    }
  ],
  "evaluate": {
    "self_check": [
      "我做错的是因为不知道用哪个方法，还是知道用哪个但做错了？",
      "混着练的时候，我有没有先停顿判断题型，还是直接开做？"
    ],
    "success_criteria": [
      "综合卷的错题里「选错方法」占比下降",
      "相邻同型题不再连错"
    ]
  },
  "agent_contract": {
    "input": [
      "topic",
      "rounds"
    ],
    "output": [
      "题型清单",
      "作答记录",
      "错因标注表"
    ],
    "side_effects": [
      "仅写本地文件"
    ],
    "degrade_to": "无工具时：对话式一问一答出题，不联网检索"
  },
  "resources": [],
  "metadata": {
    "created_at": "2026-10-21",
    "updated_at": "2026-10-21",
    "contributors": []
  }
}
