{
  "lmp": "0.1",
  "id": "closed-book-writing",
  "name": "合书写作",
  "name_en": "Closed-Book Writing",
  "version": "0.1.0",
  "license": "CC0-1.0",
  "authors": ["OpenLMP 公共领域贡献"],
  "category": "评测验证",
  "evidence": "high",
  "evidence_refs": [
    "Kang, McDermott & Roediger 2007, Psychological Science 18(6) 409-414（测试效应：先提取再学比先学再提取效果更好）"
  ],
  "description": "合上资料先写 10 分钟，再打开资料补充。用「写不出的地方」精确标出你的真实缺口，而不是靠重读掩盖。",
  "when_to_use": ["备考写作/论述题", "准备汇报或分享", "读完后想检验掌握程度"],
  "when_not_to_use": ["第一次接触这个主题（没东西可写）"],
  "params": {
    "type": "object",
    "required": ["topic"],
    "properties": { "topic": { "type": "string" }, "duration_min": { "type": "integer", "default": 10 } }
  },
  "requires": { "tools": [], "assets": [] },
  "steps": [
    {
      "id": "blank-draft",
      "name": "合书盲写",
      "instruction": "严禁打开任何资料。直接就topic 写一段能写多少写多少。写不出来的地方留空或写「忘了」，**不要靠模糊措辞蒙混过关**。",
      "duration_min": 10,
      "checkpoint": "产出了 ≥300 字的盲写稿；且留白处明确标了「忘了/不确定」",
      "output": "blind draft"
    },
    {
      "id": "mark-holes",
      "name": "标记真实缺口",
      "instruction": "只看盲写稿，用红笔圈出：① 写不出的 ② 写错或不确定的 ③ 写得含糊其辞的。**这三类就是你的学习清单，别的都不用管。**",
      "duration_min": 6,
      "checkpoint": "圈出的缺口 ≥3 处；且缺口类型已区分（不会/不确定/表述含糊）",
      "output": "gap map"
    },
    {
      "id": "look-up",
      "name": "只补缺口",
      "instruction": "现在才开资料。**只查圈出的缺口，不重读全文。** 每补一处就在旁边写上正确答案。",
      "duration_min": 15,
      "checkpoint": "每处缺口都有对应补充；且未查阅缺口以外的材料",
      "output": "补完的稿子"
    },
    {
      "id": "rewrite",
      "name": "重写一次",
      "instruction": "合上资料，把这一节**从头重写一遍**，这次必须把刚才补的内容自然融进去。",
      "duration_min": 10,
      "checkpoint": "重写版中不再有「忘了」标记；且不是照抄补充说明而是重写",
      "output": "final version"
    },
    {
      "id": "test-tomorrow",
      "name": "次日复测",
      "instruction": "第二天不看任何材料，仅凭记忆再写一次同样内容。",
      "duration_min": 10,
      "checkpoint": "次日版与终版覆盖率 ≥70%；未覆盖的部分进入间隔复习队列",
      "output": "next-day retest + srs"
    }
  ],
  "evaluate": {
    "self_check": [
      "盲写的时候我是不是偷偷看了资料？",
      "圈出来的缺口，是不是正好就是考试/汇报会问我「你不知道怎么答」的地方？"
    ],
    "success_criteria": ["次日复测覆盖率 ≥70%", "同类问题的空心率逐次下降"]
  },
  "agent_contract": {
    "input": ["topic"], "output": ["blind draft", "gap map"],
    "side_effects": ["写本地文件"],
    "degrade_to": "Agent 绝不能在 step1 到 step3 之间泄露答案或引用；如用户表示看过资料，必须显式记录为「已污染」，该轮测试结果作废"
  },
  "resources": [],
  "metadata": { "created_at": "2026-10-21", "updated_at": "2026-10-21", "contributors": [] }
}